content_id,title
b8a12133-7e60-5d4a-8854-16a4e4b9ba1a,Incorrect Advice to Customers
07f0ab4f-d4b5-5f10-bbe1-dc0543149954,Incorrect Advice to Customers- Introduction
95e3ea94-e4b4-57a9-a91b-842ed30eecb0,Incorrect Advice to Customers- Collection and management
10e1791f-2d15-58f7-abd4-88c5983747aa,Incorrect Advice to Customers- When incorrect advice can be binding
25567f1d-c46a-585c-92d8-51c797ab708c,Incorrect Advice to Customers- Detriment
601fdf74-aeb1-5ca4-9010-8520a71578fc,Incorrect Advice to Customers- Tax specific issues
1aac6e95-1ec6-53e8-806a-2baa7d06e5bd,What this means in practice- Contents
